[
  {
    "fact_id": "fact-catalogue_db-0001",
    "case_id": "case-001",
    "kind": "anomaly_observed",
    "statement": "catalogue-db p90 latency anomaly (812ms) observed in window.",
    "component_ids": ["catalogue-db"],
    "event_ids": ["metric-catalogue_db-000002"],
    "modality": "metric",
    "ts_range": { "start": 1700000030.0, "end": 1700000060.0 },
    "confidence": 0.92,
    "hypothesis_id": "hyp-catalogue_db-01"
  },
  {
    "fact_id": "fact-catalogue-0002",
    "case_id": "case-001",
    "kind": "anomaly_observed",
    "statement": "catalogue emitted rare connection-refused template T042.",
    "component_ids": ["catalogue"],
    "event_ids": ["log-catalogue-000001"],
    "modality": "log",
    "ts_range": { "start": 1700000031.0, "end": 1700000041.0 },
    "confidence": 0.83,
    "hypothesis_id": "hyp-catalogue_db-01"
  },
  {
    "fact_id": "fact-orders-0003",
    "case_id": "case-001",
    "kind": "anomaly_absent",
    "statement": "No metric anomaly detected on orders within the incident window.",
    "component_ids": ["orders"],
    "event_ids": [],
    "modality": "metric",
    "ts_range": { "start": 1700000030.0, "end": 1700000060.0 },
    "confidence": 0.8,
    "hypothesis_id": null
  },
  {
    "fact_id": "fact-front_end-0004",
    "case_id": "case-001",
    "kind": "topology_path",
    "statement": "Directed path exists: front-end -> catalogue -> catalogue-db.",
    "component_ids": ["front-end", "catalogue", "catalogue-db"],
    "event_ids": ["topology-front_end-000001", "topology-catalogue-000003"],
    "modality": "topology",
    "ts_range": { "start": 1700000000.0, "end": 1700000000.0 },
    "confidence": 1.0,
    "hypothesis_id": "hyp-catalogue_db-01"
  },
  {
    "fact_id": "fact-payment-0005",
    "case_id": "case-001",
    "kind": "topology_no_path",
    "statement": "No directed path from payment to catalogue-db; cross-fault contamination ruled out.",
    "component_ids": ["payment", "catalogue-db"],
    "event_ids": [],
    "modality": "topology",
    "ts_range": { "start": 1700000000.0, "end": 1700000000.0 },
    "confidence": 1.0,
    "hypothesis_id": null
  },
  {
    "fact_id": "fact-catalogue_db-0006",
    "case_id": "case-001",
    "kind": "temporal_order",
    "statement": "config change on catalogue-db precedes front-end 5xx alert by 19s.",
    "component_ids": ["catalogue-db", "front-end"],
    "event_ids": ["config-catalogue_db-000001", "alert-front_end-000002"],
    "modality": "mixed",
    "ts_range": { "start": 1700000020.0, "end": 1700000039.0 },
    "confidence": 0.95,
    "hypothesis_id": "hyp-catalogue_db-01"
  },
  {
    "fact_id": "fact-catalogue_db-0007",
    "case_id": "case-001",
    "kind": "config_change_observed",
    "statement": "catalogue-db max_connections changed 200 -> 50 (flagged risky).",
    "component_ids": ["catalogue-db"],
    "event_ids": ["config-catalogue_db-000001"],
    "modality": "config",
    "ts_range": { "start": 1700000020.0, "end": 1700000020.0 },
    "confidence": 1.0,
    "hypothesis_id": "hyp-catalogue_db-01"
  },
  {
    "fact_id": "fact-catalogue_db-0008",
    "case_id": "case-001",
    "kind": "counterfactual_result",
    "statement": "Removing catalogue-db leaves only 16.7% of anomalies explained by remaining suspects.",
    "component_ids": ["catalogue-db"],
    "event_ids": [],
    "modality": "derived",
    "ts_range": { "start": 1700000030.0, "end": 1700000060.0 },
    "confidence": 0.9,
    "hypothesis_id": "hyp-catalogue_db-01"
  },
  {
    "fact_id": "fact-catalogue_db-0009",
    "case_id": "case-001",
    "kind": "twin_result",
    "statement": "Simulated twin with the config fault reproduced observed anomalies (similarity 0.86, verdict match).",
    "component_ids": ["catalogue-db"],
    "event_ids": [],
    "modality": "derived",
    "ts_range": { "start": 1700000020.0, "end": 1700000060.0 },
    "confidence": 0.86,
    "hypothesis_id": "hyp-catalogue_db-01"
  },
  {
    "fact_id": "fact-orders-0010",
    "case_id": "case-001",
    "kind": "coverage_gap",
    "statement": "No metric stream ingested for orders-db; downstream db effects unobservable.",
    "component_ids": ["orders-db"],
    "event_ids": [],
    "modality": "metric",
    "ts_range": { "start": 1700000000.0, "end": 1700000060.0 },
    "confidence": 0.5,
    "hypothesis_id": null
  },
  {
    "fact_id": "fact-catalogue_db-0011",
    "case_id": "case-001",
    "kind": "hypothesis_scored",
    "statement": "hyp-catalogue_db-01 scored 0.70 and tiered CONFIRMED.",
    "component_ids": ["catalogue-db"],
    "event_ids": [],
    "modality": "derived",
    "ts_range": { "start": 1700000020.0, "end": 1700000060.0 },
    "confidence": 0.7,
    "hypothesis_id": "hyp-catalogue_db-01"
  },
  {
    "fact_id": "fact-catalogue-0012",
    "case_id": "case-001",
    "kind": "anomaly_observed",
    "statement": "catalogue CPUThrottling alert firing during the window.",
    "component_ids": ["catalogue"],
    "event_ids": ["alert-catalogue-000003"],
    "modality": "alert",
    "ts_range": { "start": 1700000035.0, "end": 1700000065.0 },
    "confidence": 0.6,
    "hypothesis_id": "hyp-catalogue-02"
  }
]
